Rank,title,genre,description,Director,Actors,Year,Runtime (Minutes),Rating,Votes,Revenue (Millions),Metascore,id,type,release_year,age_certification,runtime,production_countries,seasons,imdb_id,imdb_score,imdb_votes,tmdb_popularity,tmdb_score
,Mildred Pierce,['drama'],"mildred pierce depicts an overprotective, self-sacrificing mother during the great depression who finds herself separated from her husband, opening a restaurant of her own and falling in love with a man, all the while trying to earn her spoiled, narcissistic daughter's love and respect.",,,,,,,,,ts21324,SHOW,2011.0,TV-MA,67.0,['US'],1.0,tt1492030,7.6,22432.0,15.242,7.199
,Eagleheart,"['action', 'comedy']","eagleheart is an action-comedy television series that premiered on february 3, 2011, on adult swim.",,,,,,,,,ts9986,SHOW,2011.0,TV-MA,13.0,['US'],3.0,tt1728860,7.4,2074.0,5.227,7.1
,Mortal Kombat: Legacy,"['action', 'scifi', 'crime', 'fantasy', 'thriller']","the first season of mortal kombat legacy is a prequel to the original game, explaining the background stories of several characters from the series and demonstrating their reasons for participating in the upcoming tenth mortal kombat tournament on which the first game was based.",,,,,,,,,ts20603,SHOW,2011.0,TV-MA,10.0,"['CA', 'US']",2.0,tt1842127,7.4,9648.0,19.514,6.9
,Major Crimes,"['drama', 'action', 'crime']",major crimes explores how the american justice system approaches the art of the deals as law enforcement officers and prosecutors work together to score a conviction. los angeles police captain sharon raydor heads up a special squad within the lapd that deals with high-profile or particularly sensitive crimes.,,,,,,,,,ts20391,SHOW,2012.0,TV-14,43.0,['US'],6.0,tt1936532,7.7,14790.0,35.509,7.3
,Parade's End,"['drama', 'war', 'history', 'action', 'romance', 'european']","the story of a love triangle between a conservative english aristocrat, his mean socialite wife and a young suffragette in the midst of world war i and a europe on the brink of profound change.",,,,,,,,,ts21101,SHOW,2012.0,TV-MA,59.0,['GB'],1.0,tt1956017,7.5,10404.0,5.103,6.837
,Witness,"['documentation', 'crime']","drug trafficking, poverty, gang violence, corruption and ethnic warfare have created some of the most dangerous hot spots on earth. follow our current generation of photojournalists into these conflict zones, see what compels them and experience why, when everyone else seeks cover, the photojournalist stands and moves closer.",,,,,,,,,ts26754,SHOW,2012.0,TV-MA,46.0,['US'],1.0,tt5616618,7.8,267.0,3.319,7.5
,Black Dynamite,"['comedy', 'action', 'crime', 'drama', 'animation']","black dynamite is an american animated television series based on the 2009 film of the same name, although the series follows a separate continuity, with some back-references to the film. the series was announced shortly after the release of the film, the 10-minute pilot episode was released on adult swim video on august 8, 2011, and the full series premiered on cartoon network's late night programming block, adult swim, on july 15, 2012. michael jai white, byron minns, tommy davidson and kym whitley reprise their film roles as black dynamite, bullhorn, cream corn and honeybee, respectively.",,,,,,,,,ts465,SHOW,2012.0,TV-MA,24.0,['US'],2.0,tt1608383,8.1,4641.0,11.694,7.7
,Ben 10: Omniverse,"['action', 'scifi', 'family', 'animation', 'comedy']","a year after the events that took place during the ""final battle"" and after the destruction of omnitrix, 16-year-old ben tennyson has to face new enemies.",,,,,,,,,ts10822,SHOW,2012.0,TV-Y7,22.0,['US'],8.0,tt2293002,6.2,5993.0,53.897,8.202
,Green Lantern: The Animated Series,"['action', 'scifi', 'animation', 'family']",the green lanterns hal and his partner kilowog fight against the forces of the red lanterns.,,,,,,,,,ts20440,SHOW,2011.0,TV-PG,22.0,['US'],1.0,tt1724587,8.0,7104.0,18.778,7.797
,Loiter Squad,['comedy'],"loiter squad is an american sketch comedy television series starring tyler, the creator, jasper dolphin, taco bennett, and lionel boyce from the los angeles hip hop group odd future. the show regularly features other members of the group as well. jeff tremaine, shanna zablow, dimitry elyashkevich, lance bangs, nick weidenfeld and keith crofford are the show's executive producers. the show is produced by dickhouse entertainment for cartoon network's adult swim programming block. the show's second season made its debut on march 10, 2013.",,,,,,,,,ts28066,SHOW,2012.0,TV-MA,12.0,['US'],3.0,tt2272367,6.9,2450.0,6.071,7.385
,Luck,"['drama', 'sport']","a drama set in the world of horse racing focusing on lives of owners, jockeys, trainers and gamblers who are all tied to the same horse track.",,,,,,,,,ts20654,SHOW,2012.0,TV-MA,53.0,['US'],2.0,tt1578887,7.4,5960.0,5.231,6.656
,Profugos,"['action', 'crime', 'drama', 'thriller']","four men become fugitives after a failed drug deal, running from north to south of chile.",,,,,,,,,ts20680,SHOW,2011.0,TV-MA,51.0,['CL'],2.0,tt1941928,7.9,1236.0,5.274,6.3
,"The Heart, She Holler","['comedy', 'horror']","the heart, she holler is a live action television series produced by pffr for adult swim. the series, described as ""southern gothic drama"" and ""an inside-out blend of soap opera and politically incorrect surrealist comedy,"" is about the long-lost son of the heartshe dynasty – played by patton oswalt – returning to run the town and being locked in conflict with sisters hurshe and hambrosia. the show premiered on november 6, 2011, and its 14-episode second season premiered on september 11, 2013.

the title of the series is a play on words, in that the name of the family which controls the town is ""heartshe"", and ""holler"" is an appalachian pronunciation of the word ""hollow"", meaning small valley, essentially making it ""the heartshe hollow"".",,,,,,,,,ts21805,SHOW,2011.0,TV-MA,12.0,['US'],3.0,tt2104664,6.5,1364.0,6.851,7.333
,"China, IL","['animation', 'comedy']","china, il – meaning ""china, illinois"" – is an animated television series for the cable network adult swim. the series is created by brad neely, and features neely's existing characters from the china, il web series and special. characters include frank and steve smith, aka ""the professor brothers,"" and mark ""baby"" cakes. neely provides the voice for all three characters. the series is produced by williams street and animated by titmouse, inc. china, il has been renewed for a second season with the possibility of a new half-hour runtime.

on may 25, 2008, adult swim ran the funeral, an 11-minute special which was streamed on the now defunct super deluxe website. the special combined brad neely's professor brothers and baby cakes webseries, which were also streamed at super deluxe, and established a larger environment for the characters. the special, as well as brad neely's other videos, can be viewed at neely's youtube page.",,,,,,,,,ts12221,SHOW,2011.0,TV-14,20.0,['US'],3.0,tt2058221,7.1,2458.0,3.42,6.5
,Garfunkel and Oates,['comedy'],hbo digital comedy.,,,,,,,,,ts357994,SHOW,2012.0,TV-MA,4.0,['US'],1.0,tt12989256,7.7,203.0,2.785,6.5
,Rick and Morty,"['animation', 'scifi', 'action', 'comedy']","rick is a mentally-unbalanced but scientifically gifted old man who has recently reconnected with his family. he spends most of his time involving his young grandson morty in dangerous, outlandish adventures throughout space and alternate universes. compounded with morty's already unstable family life, these events cause morty much distress at home and school.",,,,,,,,,ts20233,SHOW,2013.0,TV-MA,22.0,['US'],6.0,tt2861424,9.1,540708.0,534.42,8.729
,True Detective,"['drama', 'crime', 'thriller']","an american anthology police detective series utilizing multiple timelines in which investigations seem to unearth personal and professional secrets of those involved, both within or outside the law.",,,,,,,,,ts20054,SHOW,2014.0,TV-MA,60.0,['US'],4.0,tt2356777,8.9,583719.0,56.729,8.289
,Last Week Tonight with John Oliver,"['comedy', 'reality', 'history']","a half-hour satirical look at the week in news, politics and current events.",,,,,,,,,ts20735,SHOW,2014.0,TV-MA,31.0,['US'],10.0,tt3530232,8.9,90706.0,80.941,7.924
,The Leftovers,"['scifi', 'drama', 'fantasy', 'thriller']","when 2% of the world's population abruptly disappears without explanation, the world struggles to understand just what they're supposed to do about it. the drama series 'the leftovers' is the story of the people who didn't make the cut.",,,,,,,,,ts20275,SHOW,2014.0,TV-MA,58.0,['US'],3.0,tt2699128,8.3,102051.0,27.042,7.639
,Banshee,"['drama', 'thriller', 'action', 'crime']",banshee is an american drama television series set in a small town in pennsylvania amish country and features an enigmatic ex-con posing as a murdered sheriff who imposes his own brand of justice while also cooking up plans that serve his own interests.,,,,,,,,,ts13608,SHOW,2013.0,TV-MA,51.0,['US'],4.0,tt2017109,8.4,108017.0,57.813,7.953
,Anthony Bourdain: Parts Unknown,['documentation'],"bourdain travels across the globe to uncover little-known areas of the world and celebrate diverse cultures by exploring food and dining rituals. known for his curiosity, candor, and acerbic wit, bourdain takes viewers off the beaten path of tourist destinations – including some war-torn parts of the world – and meets with a variety of local citizens to offer a window into their lifestyles, and occasionally communes with an internationally lauded chef on his journeys.",,,,,,,,,ts9325,SHOW,2013.0,TV-PG,44.0,['US'],12.0,tt2845786,8.8,6434.0,15.764,7.3
,Silicon Valley,['comedy'],"in the high-tech gold rush of modern silicon valley, the people most qualified to succeed are the least capable of handling success. partially inspired by mike judge’s own experiences as a silicon valley engineer in the late ‘80s, silicon valley is an american sitcom that centers around six programmers who are living together and trying to make it big in the silicon valley.",,,,,,,,,ts20760,SHOW,2014.0,TV-MA,29.0,['US'],6.0,tt2575988,8.5,153896.0,36.2,8.129
,Nathan For You,"['documentation', 'comedy']","self-proclaimed business expert, writer, director and comedian nathan fielder helps real small businesses turn a profit with marketing tactics that no ordinary consultant would dare to attempt. from driving foot traffic to an off-the-strip souvenir shop by using hollywood flair and a johnny depp impersonator, to creating a rebate that can only be redeemed by climbing a mountain, to founding a coffee shop called ""dumb starbucks,” nathan has always gone to the limit to make his ideas come to life. with his unorthodox approach to problem solving, nathan’s genuine efforts to do good often draw the real people he encounters into an experience far beyond what they signed up for.",,,,,,,,,ts37645,SHOW,2013.0,TV-14,25.0,['US'],4.0,tt2297757,8.9,32715.0,9.629,8.1
,Over the Garden Wall,"['scifi', 'comedy', 'fantasy', 'horror', 'thriller', 'action', 'animation', 'drama', 'family']","two brothers, wirt and greg, find themselves lost in the unknown; a strange forest adrift in time. with the help of a wise old woodsman and a foul-tempered bluebird named beatrice, wirt and greg must travel across this strange land, in hope of finding their way home. join them as they encounter surprises and obstacles on their journey through the wood.",,,,,,,,,ts20079,SHOW,2014.0,TV-PG,11.0,['US'],1.0,tt3718778,8.8,59611.0,26.143,8.504
,The Knick,"['drama', 'history']","set in downtown new york in 1900, 'the knick' is centered on the knickerbocker hospital and the groundbreaking surgeons, nurses and staff who work there, pushing the bounds of medicine in a time of astonishingly high mortality rates and zero antibiotics.

john thackery is a brilliant surgeon pioneering new methods in the field, despite his secret addiction to cocaine. he leads a team of doctors including his protégé dr. everett gallinger; the young dr. bertie chickering jr. and dr. algernon edwards, a promising surgeon who's been recently thrust upon him. the lively cast of characters at the hospital also includes cornelia robertson, the daughter of its benefactor, captain august robertson; surly ambulance driver tom cleary; lucy elkins; a fresh-faced nurse from the country; the crooked hospital administrator herman barrow; and sister harriet, a nun who isn't afraid to speak her mind.",,,,,,,,,ts20732,SHOW,2014.0,TV-MA,54.0,['US'],2.0,tt2937900,8.5,49846.0,11.349,7.923
,Gotham,"['scifi', 'crime', 'drama', 'thriller', 'action']","everyone knows the name commissioner gordon. he is one of the crime world's greatest foes, a man whose reputation is synonymous with law and order. but what is known of gordon's story and his rise from rookie detective to police commissioner? what did it take to navigate the multiple layers of corruption that secretly ruled gotham city, the spawning ground of the world's most iconic villains? and what circumstances created them – the larger-than-life personas who would become catwoman, the penguin, the riddler, two-face and the joker?",,,,,,,,,ts20292,SHOW,2014.0,TV-14,43.0,['US'],5.0,tt3749900,7.8,233081.0,98.713,7.606
,Steven Universe,"['comedy', 'action', 'scifi', 'animation', 'drama', 'fantasy', 'thriller', 'family']","a young boy takes his mother's place in a group of gemstone-based beings, and must learn to control his powers.",,,,,,,,,ts20113,SHOW,2013.0,TV-PG,11.0,['US'],6.0,tt3061046,8.2,35237.0,130.73,8.468
,Gomorrah,"['drama', 'thriller', 'crime', 'european']","based on robert saviano's bestselling book, this gritty italian crime drama paints a portrait of the brutal neapolitan crime organisation the camorra, as seen through the eyes of ciro di marzo, the obedient and self- confident right-hand man of the clan's godfather, pietro savastano.",,,,,,,,,ts20303,SHOW,2014.0,TV-MA,47.0,['IT'],5.0,tt2049116,8.7,41062.0,52.986,8.09
,Olive Kitteridge,['drama'],"a look at a seemingly placid new england town that is actually wrought with illicit affairs, crime and tragedy, all told through the lens of olive, whose wicked wit and harsh demeanor mask a warm but troubled heart and staunch moral center. the story spans 25 years and focuses on olive's relationships with her husband, henry, the good-hearted and kindly town pharmacist; their son, christopher, who resents his mother's approach to parenting; and other members of their community.",,,,,,,,,ts20287,SHOW,2014.0,TV-14,60.0,['US'],1.0,tt3012698,8.3,23734.0,10.091,7.563
,Looking,"['comedy', 'drama', 'romance']",three friends in san francisco who explore the fun and sometimes overwhelming options available to a new generation of gay men.,,,,,,,,,ts20255,SHOW,2014.0,TV-MA,28.0,['US'],2.0,tt2581458,8.2,20004.0,9.272,7.3
,The Carbonaro Effect,['comedy'],"michael carbonaro is a magician by trade, but a prankster by heart. michael performs baffling tricks on unsuspecting people in everyday situations, all caught on hidden camera. everyone is left stunned and delighted, even though they have no idea what just hit them.",,,,,,,,,ts10932,SHOW,2014.0,TV-14,22.0,['US'],6.0,tt3559912,7.5,2425.0,7.684,7.4
,Teen Titans Go!,"['scifi', 'comedy', 'action', 'family', 'crime', 'animation', 'fantasy']","robin, starfire, raven, beast boy and cyborg return in all-new, comedic adventures. they may be super heroes who save the world every day ... but somebody still has to do the laundry!",,,,,,,,,ts35726,SHOW,2013.0,TV-PG,16.0,['US'],8.0,tt2771780,5.4,22200.0,105.161,6.8
,Mr. Pickles,"['animation', 'comedy', 'horror']","the goodman family lives with their lovable pet dog, mr. pickles, a deviant border collie with a secret satanic streak.",,,,,,,,,ts20367,SHOW,2014.0,TV-MA,11.0,['US'],4.0,tt2950342,7.3,9187.0,32.453,8.2
,Fixer Upper,['reality'],"renovation, design and real estate pros chip and joanna gaines are paired with waco/dallas, texas-area buyers to renovate the wrong house that's in the right location.",,,,,,,,,ts8959,SHOW,2013.0,TV-G,43.0,['US'],5.0,tt4591390,8.1,3228.0,7.513,7.7
,Blippi,['family'],blippi is an energetic character that jumps off the screen with his goofy mannerisms but friendly demeanor. children from the ages of 2 to 7 years old have quickly taken a liking to blippi's fun personality and innovative teaching lessons.,,,,,,,,,ts123577,SHOW,2014.0,TV-Y7,20.0,['US'],3.0,tt6594882,6.6,513.0,9.432,2.0
,Your Pretty Face Is Going to Hell,"['comedy', 'fantasy', 'animation']","a live-action workplace comedy about gary, an associate demon, as he attempts to capture souls on earth in order to climb the corporate ladder of the underworld. gary hopes to advance in hell, but he may be too stupid, lazy and kind-hearted to realize his dreams of promotion. meanwhile, gary's intern claude is more talented, more devious and will do whatever it takes to impress satan.",,,,,,,,,ts32076,SHOW,2013.0,TV-MA,11.0,['US'],4.0,tt2362694,7.8,2822.0,4.51,7.2
,Shadows,"['drama', 'thriller', 'crime', 'european']","relu is a family man. he has two children, a wife and a double life. seen through the eyes of his family, relu oncescu appears to be an ordinary taxi driver. no one suspects that relu works as a collector for capitanu', a local mobster. neither of the two worlds (his family and the mafia) knows of the other's existence. relu manages to keep everything under control, but not for long. after accidentally killing a man, he tries to get out of the underworld, but he can't find his way back. day by day, the secrets he keeps become increasingly oppressive and the lies begin to surface, one by one.",,,,,,,,,ts20349,SHOW,2014.0,TV-MA,53.0,['RO'],3.0,tt4269716,8.7,10636.0,4.273,8.424
,Tim and Eric's Bedtime Stories,"['comedy', 'horror']",tim and eric's dark comedy anthology series.,,,,,,,,,ts58470,SHOW,2014.0,TV-14,13.0,['US'],2.0,tt3292726,7.8,2437.0,5.585,7.4
,Sr. Ávila,"['action', 'crime', 'drama', 'thriller']",a family man experiences the tremendous burden of leading a double life as a professional hitman.,,,,,,,,,ts41319,SHOW,2013.0,TV-MA,53.0,['MX'],4.0,tt2280066,8.2,993.0,10.28,8.1
,Black Jesus,['comedy'],"a tv series finds jesus living in present day compton, ca on a daily mission to spread love and kindness throughout the neighborhood with the help of his small but loyal group of downtrodden followers.",,,,,,,,,ts222,SHOW,2014.0,TV-MA,21.0,['US'],3.0,tt3589872,7.0,3653.0,8.053,5.4
,Getting On,['comedy'],"set in a geriatric extended care wing of a down-at-the-heels hospital, getting on follows put-upon nurses, anxious doctors and administrators as they struggle with the darkly comic, brutally honest and quietly compassionate realities of caring for the elderly.",,,,,,,,,ts20095,SHOW,2013.0,TV-MA,28.0,['US'],3.0,tt2342652,7.8,3732.0,6.776,6.68
,Beware the Batman,"['action', 'scifi', 'animation', 'crime', 'drama']","set during bruce wayne's early years as the batman, following his initial period of battling organized crime. he hones his skills with the assistance of his butler, alfred pennyworth. bruce is introduced to alfred's goddaughter, tatsu yamashiro. tatsu is a martial arts swordsmaster hired to act as bruce's bodyguard, but also recruited to act as a superhero partner to batman.",,,,,,,,,ts3139,SHOW,2013.0,TV-PG,22.0,['US'],1.0,tt2329077,7.3,4410.0,13.615,7.451
,Clarence,"['comedy', 'family', 'animation']","in a world of noise, clarence is a jar of sunshine, pure and simple. he sees the world only in his favorite colors: goofy grape and neon green. clarence values his friends jeff and sumo and his mother mary more than gold. no matter what happens, good or bad, nothing brings clarence down.",,,,,,,,,ts11963,SHOW,2014.0,TV-PG,14.0,['US'],3.0,tt3061050,6.8,10242.0,65.074,7.622
,Hello Ladies,['comedy'],"stuart pritchard is an awkward, overly-confident englishman trying to date in los angeles – where he repeatedly attempts to infiltrate the world of beautiful people.",,,,,,,,,ts32574,SHOW,2013.0,TV-MA,29.0,['US'],1.0,tt2378794,7.4,12946.0,8.657,6.8
,El Negocio (The Business),"['drama', 'comedy']","karin, magali and luna are three call girls, who decide to apply some marketing knowledge on the world's oldest profession.",,,,,,,,,ts35391,SHOW,2013.0,TV-MA,53.0,['BR'],4.0,tt2650940,8.0,1705.0,17.293,7.877
,Family Tree,['comedy'],"having recently lost his job and his girlfriend, 30-year-old tom chadwick has a rather unsure sense of his own identity. but when he inherits a mysterious box of belongings from a great aunt he never met, tom starts investigating his lineage and uncovers a whole world of unusual stories and characters, acquiring a growing sense of who he and his real family are.",,,,,,,,,ts10750,SHOW,2013.0,TV-MA,22.0,"['US', 'GB']",1.0,tt2340036,7.4,3560.0,2.136,6.536
,Saving My Tomorrow,"['documentation', 'family']","from the children who will inherit the planet, comes a collection of songs, activism, and heartfelt tips for protecting the earth. kids share their thoughts on subjects ranging from endangered animals and pollution to climate change.",,,,,,,,,ts84205,SHOW,2014.0,TV-G,28.0,['US'],1.0,tt4195814,6.6,53.0,1.493,6.0
,The Night Of,"['thriller', 'drama', 'crime']","after a night of partying with a female stranger, a man wakes up to find her stabbed to death and is charged with her murder.",,,,,,,,,ts38802,SHOW,2016.0,TV-MA,65.0,['US'],1.0,tt2401256,8.5,141124.0,18.012,7.925
,The Jinx: The Life and Deaths of Robert Durst,"['documentation', 'crime']","robert durst, scion of one of new york’s billionaire real estate families, has been accused of three murders but never convicted. brilliant, reclusive, and the subject of relentless media scrutiny, he’s never spoken publicly—until now. during interviews with andrew jarecki, he reveals secrets of the case that baffled authorities for 30 years. in 2010, jarecki made the narrative film all good things based on the infamous story of robert durst. after durst saw the film, he contacted jarecki wanting to tell his story. what began as a feature documentary ultimately became a six-part series as more and more of his incredible story was revealed.",,,,,,,,,ts21650,SHOW,2015.0,TV-MA,45.0,['US'],1.0,tt4299972,8.6,47685.0,8.806,8.021
,The Great Pottery Throw Down,['reality'],"ten home potters from around the country head to stoke-on-trent, the home of pottery, in their quest to become top potter.",,,,,,,,,ts79258,SHOW,2015.0,TV-14,55.0,['GB'],6.0,tt6417190,8.6,1133.0,23.415,7.1
,Good Behavior,"['drama', 'thriller', 'crime']","letty dobesh is a thief and con artist fresh out of prison whose life is always one wrong turn and bad decision from implosions — just how she likes it. but when she overhears a hitman being hired to kill a man’s wife, she sets out to derail the job, launching her on a collision course with the killer, entangling them in a dangerous and seductive relationship.",,,,,,,,,ts41288,SHOW,2016.0,TV-MA,48.0,['US'],2.0,tt4855114,8.0,11153.0,10.604,7.0
,Insecure,"['drama', 'comedy', 'romance']",follows the awkward experiences and racy tribulations of a modern-day african-american woman.,,,,,,,,,ts46210,SHOW,2016.0,TV-MA,32.0,['US'],5.0,tt5024912,8.0,19584.0,16.792,7.639
,Search Party,"['comedy', 'crime', 'drama', 'thriller', 'romance']",search party is a dark comedy about four self-absorbed twenty-somethings who become entangled in an ominous mystery when a former college acquaintance suddenly disappears.,,,,,,,,,ts41158,SHOW,2016.0,TV-MA,25.0,['US'],5.0,tt5460226,7.6,12212.0,17.357,6.959
,Vice Principals,['comedy'],"the story of a high school and the people who almost run it, the vice principals.",,,,,,,,,ts38803,SHOW,2016.0,TV-MA,31.0,['US'],2.0,tt3766376,8.0,27809.0,12.696,7.028
,The Young Pope,"['drama', 'european']","lenny belardo, the youngest and first american pope in the history of the church, must establish his new papacy and navigate the power struggles of the closed, secretive vatican.",,,,,,,,,ts41827,SHOW,2016.0,TV-MA,59.0,"['ES', 'US', 'FR', 'IT', 'GB']",1.0,tt3655448,8.3,45112.0,15.495,7.727
,Adam Ruins Everything,"['comedy', 'history', 'documentation', 'animation']","host adam conover employs a combination of comedy, history and science to dispel widespread misconceptions about everything we take for granted.",,,,,,,,,ts38383,SHOW,2015.0,TV-14,23.0,['US'],3.0,tt5034326,8.1,7141.0,11.631,7.7
,Ballers,"['drama', 'comedy', 'sport']","looking at the lives of former and current football players, the show follows former superstar spencer strasmore as he gets his life on track in retirement while mentoring other current and former players through the daily grind of the business of football.",,,,,,,,,ts35552,SHOW,2015.0,TV-MA,29.0,['US'],5.0,tt2891574,7.6,45258.0,54.0,6.712
,Nuclear Family,['documentation'],a sketch comedy series that parodies pop culture and internet trends.,,,,,,,,,ts271031,SHOW,2016.0,TV-MA,58.0,['US'],1.0,tt15254840,7.1,447.0,0.6,8.2
,Divorce,"['comedy', 'drama']","a middle-aged couple experience the pain, the relief and the trials and tribulations of a divorce in this dry, witty comedy.",,,,,,,,,ts42041,SHOW,2016.0,TV-MA,29.0,['US'],3.0,tt0251505,5.8,5.0,6.956,6.4
,"Be Cool, Scooby-Doo!","['animation', 'thriller', 'family', 'comedy']","the gang decide to go traveling in the mystery machine, seeking fun and adventure during what could possibly be their last summer break together. however, havoc-wreaking monsters seem to be drawn to them, appearing almost every stop of the way.",,,,,,,,,ts37956,SHOW,2015.0,TV-Y7,22.0,['US'],2.0,tt4215734,6.6,2539.0,23.386,8.406
,Chewing Gum,"['comedy', 'european']","the life of tracey, a religious, beyoncé-obsessed 22-year-old  living in an estate in tower hamlets, and the mishaps of her neighbourhood, friends and family. oh, and obvs her boyfriend!",,,,,,,,,ts38071,SHOW,2015.0,TV-MA,23.0,['GB'],2.0,tt5097050,7.7,9903.0,6.242,7.5
