Rank,title,genre,description,Director,Actors,Year,Runtime (Minutes),Rating,Votes,Revenue (Millions),Metascore,id,type,release_year,age_certification,runtime,production_countries,seasons,imdb_id,imdb_score,imdb_votes,tmdb_popularity,tmdb_score
811.0,Turbo Kid,"action,adventure,comedy","in a post-apocalyptic wasteland in 1997, a comic book fan adopts the persona of his favourite hero to save his enthusiastic friend and fight a tyrannical overlord.",François Simard,"Munro Chambers, Laurence Leboeuf, Michael Ironside, Edwin Wright",2015.0,93.0,6.7,19309.0,0.05,60.0,,,,,,,,,,,,
812.0,Mama,"horror,thriller",a young couple take in their two nieces only to suspect that a foreboding evil has latched itself to their family.,Andrés Muschietti,"Jessica Chastain, Nikolaj Coster-Waldau, Megan Charpentier, Isabelle Nélisse",2013.0,100.0,6.2,142560.0,71.59,57.0,,,,,,,,,,,,
813.0,Orphan,"horror,mystery,thriller",a husband and wife who recently lost their baby adopt a nine year-old girl who is not nearly as innocent as she claims to be.,Jaume Collet-Serra,"Vera Farmiga, Peter Sarsgaard, Isabelle Fuhrman, CCH Pounder",2009.0,123.0,7.0,153448.0,41.57,42.0,,,,,,,,,,,,
814.0,To Rome with Love,"comedy,romance","the lives of some visitors and residents of rome and the romances, adventures and predicaments they get into.",Woody Allen,"Woody Allen, Penélope Cruz, Jesse Eisenberg, Ellen Page",2012.0,112.0,6.3,72050.0,16.68,54.0,,,,,,,,,,,,
815.0,Fantastic Mr. Fox,"animation,adventure,comedy",an urbane fox cannot resist returning to his farm raiding ways and then must help his community survive the farmers' retaliation.,Wes Anderson,"George Clooney, Meryl Streep, Bill Murray, Jason Schwartzman",2009.0,87.0,7.8,149779.0,21.0,83.0,,,,,,,,,,,,
816.0,Inside Man,"crime,drama,mystery","a police detective, a bank robber, and a high-power broker enter high-stakes negotiations after the criminal's brilliant heist spirals into a hostage situation.",Spike Lee,"Denzel Washington, Clive Owen, Jodie Foster,Christopher Plummer",2006.0,129.0,7.6,285441.0,88.5,76.0,,,,,,,,,,,,
818.0,127 Hours,"adventure,biography,drama","an adventurous mountain climber becomes trapped under a boulder while canyoneering alone near moab, utah and resorts to desperate measures in order to survive.",Danny Boyle,"James Franco, Amber Tamblyn, Kate Mara, Sean Bott",2010.0,94.0,7.6,294010.0,18.33,82.0,,,,,,,,,,,,
819.0,Annabelle,"horror,mystery,thriller",a couple begins to experience terrifying supernatural occurrences involving a vintage doll shortly after their home is invaded by satanic cultists.,John R. Leonetti,"Ward Horton, Annabelle Wallis, Alfre Woodard,Tony Amendola",2014.0,99.0,5.4,91106.0,84.26,37.0,,,,,,,,,,,,
822.0,The Imaginarium of Doctor Parnassus,"adventure,fantasy,mystery",a traveling theater company gives its audience much more than they were expecting.,Terry Gilliam,"Christopher Plummer, Lily Cole, Heath Ledger,Andrew Garfield",2009.0,123.0,6.8,130153.0,7.69,65.0,,,,,,,,,,,,
823.0,G.I. Joe: The Rise of Cobra,"action,adventure,sci-fi","an elite military unit comprised of special operatives known as g.i. joe, operating out of the pit, takes on an evil organization led by a notorious arms dealer.",Stephen Sommers,"Dennis Quaid, Channing Tatum, Marlon Wayans,Adewale Akinnuoye-Agbaje",2009.0,118.0,5.8,180105.0,150.17,32.0,,,,,,,,,,,,
824.0,Christine,"biography,drama","the story of christine chubbuck, a 1970s tv reporter struggling with depression and professional frustrations as she tries to advance her career.",Antonio Campos,"Rebecca Hall, Michael C. Hall, Tracy Letts, Maria Dizzia",2016.0,119.0,7.0,5855.0,0.3,72.0,,,,,,,,,,,,
830.0,Disaster Movie,comedy,"over the course of one evening, an unsuspecting group of twenty-somethings find themselves bombarded by a series of natural disasters and catastrophic events.",Jason Friedberg,"Carmen Electra, Vanessa Lachey,Nicole Parker, Matt Lanter",2008.0,87.0,1.9,77207.0,14.17,15.0,,,,,,,,,,,,
831.0,Rocky Balboa,"drama,sport","thirty years after the ring of the first bell, rocky balboa comes out of retirement and dons his gloves for his final fight; against the reigning heavyweight champ mason 'the line' dixon.",Sylvester Stallone,"Sylvester Stallone, Antonio Tarver, Milo Ventimiglia, Burt Young",2006.0,102.0,7.2,171356.0,70.27,63.0,,,,,,,,,,,,
832.0,Diary of a Wimpy Kid: Dog Days,"comedy,family","school's out. summer vacation is on. however, greg may not have the best summer vacation ever. what could go wrong?",David Bowers,"Zachary Gordon, Robert Capron, Devon Bostick,Steve Zahn",2012.0,94.0,6.4,16917.0,49.0,54.0,,,,,,,,,,,,
833.0,Jane Eyre,"drama,romance",a mousy governess who softens the heart of her employer soon discovers that he's hiding a terrible secret.,Cary Joji Fukunaga,"Mia Wasikowska, Michael Fassbender, Jamie Bell, Su Elliot",2011.0,120.0,7.4,67464.0,11.23,76.0,,,,,,,,,,,,
834.0,Fool's Gold,"action,adventure,comedy",a new clue to the whereabouts of a lost treasure rekindles a married couple's sense of adventure -- and their estranged romance.,Andy Tennant,"Matthew McConaughey, Kate Hudson, Donald Sutherland, Alexis Dziena",2008.0,112.0,5.7,62719.0,70.22,29.0,,,,,,,,,,,,
835.0,The Dictator,comedy,the heroic story of a dictator who risked his life to ensure that democracy would never come to the country he so lovingly oppressed.,Larry Charles,"Sacha Baron Cohen, Anna Faris, John C. Reilly, Ben Kingsley",2012.0,83.0,6.4,225394.0,59.62,58.0,,,,,,,,,,,,
836.0,The Loft,"mystery,romance,thriller","five married guys conspire to secretly share a penthouse loft in the city--a place where they can carry out hidden affairs and indulge in their deepest fantasies. but the fantasy becomes a nightmare when they discover the dead body of an unknown woman in the loft, and they realize one of the group must be involved.",Erik Van Looy,"Karl Urban, James Marsden, Wentworth Miller, Eric Stonestreet",2014.0,108.0,6.3,38804.0,5.98,24.0,,,,,,,,,,,,
837.0,Bacalaureat,"crime,drama",a film about compromises and the implications of the parent's role.,Cristian Mungiu,"Adrian Titieni, Maria-Victoria Dragus, Lia Bugnar,Malina Manovici",2016.0,128.0,7.5,5531.0,0.13,84.0,,,,,,,,,,,,
838.0,You Don't Mess with the Zohan,"action,comedy",an israeli special forces soldier fakes his death so he can re-emerge in new york city as a hair stylist.,Dennis Dugan,"Adam Sandler, John Turturro, Emmanuelle Chriqui,Nick Swardson",2008.0,113.0,5.5,163144.0,100.02,54.0,,,,,,,,,,,,
841.0,Horrible Bosses 2,"comedy,crime","dale, kurt and nick decide to start their own business but things don't go as planned because of a slick investor, prompting the trio to pull off a harebrained and misguided kidnapping scheme.",Sean Anders,"Jason Bateman, Jason Sudeikis, Charlie Day, Jennifer Aniston",2014.0,108.0,6.3,125190.0,54.41,40.0,,,,,,,,,,,,
842.0,A Bigger Splash,"drama,thriller",the vacation of a famous rock star and a filmmaker in italy is disrupted by the unexpected visit of an old friend and his daughter.,Luca Guadagnino,"Tilda Swinton, Matthias Schoenaerts, Ralph Fiennes, Dakota Johnson",2015.0,125.0,6.4,15232.0,1.98,74.0,,,,,,,,,,,,
843.0,Melancholia,drama,two sisters find their already strained relationship challenged as a mysterious new planet threatens to collide with earth.,Lars von Trier,"Kirsten Dunst, Charlotte Gainsbourg, Kiefer Sutherland, Alexander Skarsgård",2011.0,135.0,7.1,137117.0,3.03,80.0,,,,,,,,,,,,
844.0,The Princess and the Frog,"animation,adventure,comedy","a waitress, desperate to fulfill her dreams as a restaurant owner, is set on a journey to turn a frog prince back into a human being, but she has to face the same problem after she kisses him.",Ron Clements,"Anika Noni Rose, Keith David, Oprah Winfrey, Bruno Campos",2009.0,97.0,7.1,95480.0,104.37,73.0,,,,,,,,,,,,
845.0,Unstoppable,"action,thriller","with an unmanned, half-mile-long freight train barreling toward a city, a veteran engineer and a young conductor race against the clock to prevent a catastrophe.",Tony Scott,"Denzel Washington, Chris Pine, Rosario Dawson, Ethan Suplee",2010.0,98.0,6.8,157499.0,81.56,69.0,,,,,,,,,,,,
846.0,Flight,"drama,thriller","an airline pilot saves almost all his passengers on his malfunctioning airliner which eventually crashed, but an investigation into the accident reveals something troubling.",Robert Zemeckis,"Denzel Washington, Nadine Velazquez, Don Cheadle, John Goodman",2012.0,138.0,7.3,276347.0,93.75,76.0,,,,,,,,,,,,
847.0,Home,"animation,adventure,comedy","an alien on the run from his own people makes friends with a girl. he tries to help her on her quest, but can be an interference.",Tim Johnson,"Jim Parsons, Rihanna, Steve Martin, Jennifer Lopez",2015.0,94.0,6.7,77447.0,177.34,55.0,,,,,,,,,,,,
848.0,La migliore offerta,"crime,drama,mystery","in the world of high-end art auctions and antiques, virgil oldman is an elderly and esteemed but eccentric genius art-expert, known and appreciated by the world. oldman is hired by a ... see full summary »",Giuseppe Tornatore,"Geoffrey Rush, Jim Sturgess, Sylvia Hoeks,Donald Sutherland",2013.0,131.0,7.8,77986.0,0.09,49.0,,,,,,,,,,,,
850.0,42,"biography,drama,sport",this movie is about jackie robinson and his journey to becoming a brooklyn dodger and his life during that time.,Brian Helgeland,"Chadwick Boseman, T.R. Knight, Harrison Ford,Nicole Beharie",2013.0,128.0,7.5,69659.0,95.0,62.0,,,,,,,,,,,,
851.0,21,"crime,drama,thriller","""21"" is the fact-based story about six mit students who were trained to become experts in card counting and subsequently took vegas casinos for millions in winnings.",Robert Luketic,"Jim Sturgess, Kate Bosworth, Kevin Spacey, Aaron Yoo",2008.0,123.0,6.8,198395.0,81.16,48.0,,,,,,,,,,,,
852.0,Begin Again,"drama,music",a chance encounter between a disgraced music-business executive and a young singer-songwriter new to manhattan turns into a promising collaboration between the two talents.,John Carney,"Keira Knightley, Mark Ruffalo, Adam Levine, Hailee Steinfeld",2013.0,104.0,7.4,111875.0,16.17,62.0,,,,,,,,,,,,
853.0,Out of the Furnace,"crime,drama,thriller","when rodney baze mysteriously disappears and law enforcement doesn't follow through fast enough, his older brother, russell, takes matters into his own hands to find justice.",Scott Cooper,"Christian Bale, Casey Affleck, Zoe Saldana, Woody Harrelson",2013.0,116.0,6.8,88829.0,11.33,63.0,,,,,,,,,,,,
854.0,Vicky Cristina Barcelona,"drama,romance","two girlfriends on a summer holiday in spain become enamored with the same painter, unaware that his ex-wife, with whom he has a tempestuous relationship, is about to re-enter the picture.",Woody Allen,"Rebecca Hall, Scarlett Johansson, Javier Bardem,Christopher Evan Welch",2008.0,96.0,7.1,208770.0,23.21,70.0,,,,,,,,,,,,
855.0,Kung Fu Panda,"animation,action,adventure","the dragon warrior has to clash against the savage tai lung as china's fate hangs in the balance: however, the dragon warrior mantle is supposedly mistaken to be bestowed upon an obese panda who is a tyro in martial arts.",Mark Osborne,"Jack Black, Ian McShane,Angelina Jolie, Dustin Hoffman",2008.0,92.0,7.6,329788.0,215.4,73.0,,,,,,,,,,,,
856.0,Barbershop: The Next Cut,"comedy,drama","as their surrounding community has taken a turn for the worse, the crew at calvin's barbershop come together to bring some much needed change to their neighborhood.",Malcolm D. Lee,"Ice Cube, Regina Hall, Anthony Anderson, Eve",2016.0,111.0,5.9,9993.0,54.01,67.0,,,,,,,,,,,,
857.0,Terminator Salvation,"action,adventure,drama","in 2018, a mysterious new weapon in the war against the machines, half-human and half-machine, comes to john connor on the eve of a resistance attack on skynet. but whose side is he on, and can he be trusted?",McG,"Christian Bale, Sam Worthington, Anton Yelchin, Moon Bloodgood",2009.0,115.0,6.6,297093.0,125.32,49.0,,,,,,,,,,,,
858.0,Freedom Writers,"biography,crime,drama","a young teacher inspires her class of at-risk students to learn tolerance, apply themselves, and pursue education beyond high school.",Richard LaGravenese,"Hilary Swank, Imelda Staunton, Patrick Dempsey, Scott Glenn",2007.0,123.0,7.5,55648.0,36.58,64.0,,,,,,,,,,,,
859.0,The Hills Have Eyes,horror,"a suburban american family is being stalked by a group of psychotic people who live in the desert, far away from civilization.",Alexandre Aja,"Ted Levine, Kathleen Quinlan, Dan Byrd, Emilie de Ravin",2006.0,107.0,6.4,136642.0,41.78,52.0,,,,,,,,,,,,
860.0,Changeling,"biography,drama,mystery","a grief-stricken mother takes on the lapd to her own detriment when it stubbornly tries to pass off an obvious impostor as her missing child, while also refusing to give up hope that she will find him one day.",Clint Eastwood,"Angelina Jolie, Colm Feore, Amy Ryan, Gattlin Griffith",2008.0,141.0,7.8,206793.0,35.71,63.0,,,,,,,,,,,,
861.0,Remember Me,"drama,romance","a romantic drama centered on two new lovers: tyler, whose parents have split in the wake of his brother's suicide, and ally, who lives each day to the fullest since witnessing her mother's murder.",Allen Coulter,"Robert Pattinson, Emilie de Ravin, Caitlyn Rund,Moisés Acevedo",2010.0,113.0,7.2,119376.0,19.06,40.0,,,,,,,,,,,,
863.0,"Alexander and the Terrible, Horrible, No Good, Very Bad Day","comedy,family","alexander's day begins with gum stuck in his hair, followed by more calamities. however, he finds little sympathy from his family and begins to wonder if bad things only happen to him, his mom, dad, brother and sister - who all find themselves living through their own terrible, horrible, no good, very bad day.",Miguel Arteta,"Steve Carell, Jennifer Garner, Ed Oxenbould, Dylan Minnette",2014.0,81.0,6.2,32310.0,66.95,54.0,,,,,,,,,,,,
864.0,Locke,drama,"ivan locke, a dedicated family man and successful construction manager, receives a phone call on the eve of the biggest challenge of his career that sets in motion a series of events that threaten his carefully cultivated existence.",Steven Knight,"Tom Hardy, Olivia Colman, Ruth Wilson, Andrew Scott",2013.0,85.0,7.1,100890.0,1.36,81.0,,,,,,,,,,,,
866.0,Horns,"drama,fantasy,horror","in the aftermath of his girlfriend's mysterious death, a young man awakens to find strange horns sprouting from his temples.",Alexandre Aja,"Daniel Radcliffe, Juno Temple, Max Minghella, Joe Anderson",2013.0,120.0,6.5,61060.0,0.16,46.0,,,,,,,,,,,,
867.0,Indignation,"drama,romance","in 1951, marcus, a working-class jewish student from new jersey, attends a small ohio college, where he struggles with sexual repression and cultural disaffection, amid the ongoing korean war.",James Schamus,"Logan Lerman, Sarah Gadon, Tijuana Ricks, Sue Dahlman",2016.0,110.0,6.9,7402.0,3.4,78.0,,,,,,,,,,,,
868.0,The Stanford Prison Experiment,"biography,drama,history",twenty-four male students out of seventy-five were selected to take on randomly assigned roles of prisoners and guards in a mock prison situated in the basement of the stanford psychology building.,Kyle Patrick Alvarez,"Ezra Miller, Tye Sheridan, Billy Crudup, Olivia Thirlby",2015.0,122.0,6.9,20907.0,0.64,67.0,,,,,,,,,,,,
869.0,Diary of a Wimpy Kid: Rodrick Rules,"comedy,family","back in middle school after summer vacation, greg heffley and his older brother rodrick must deal with their parents' misguided attempts to have them bond.",David Bowers,"Zachary Gordon, Devon Bostick, Robert Capron,Rachael Harris",2011.0,99.0,6.6,20194.0,52.69,51.0,,,,,,,,,,,,
870.0,Mission: Impossible III,"action,adventure,thriller",agent ethan hunt comes into conflict with a dangerous and sadistic arms dealer who threatens his life and his fianceé in response .,J.J. Abrams,"Tom Cruise, Michelle Monaghan, Ving Rhames, Philip Seymour Hoffman",2006.0,126.0,6.9,270429.0,133.38,66.0,,,,,,,,,,,,
871.0,En man som heter Ove,"comedy,drama","ove, an ill-tempered, isolated retiree who spends his days enforcing block association rules and visiting his wife's grave, has finally given up on life just as an unlikely friendship develops with his boisterous new neighbors.",Hannes Holm,"Rolf Lassgård, Bahar Pars, Filip Berg, Ida Engvoll",2015.0,116.0,7.7,21569.0,3.36,70.0,,,,,,,,,,,,
872.0,Dragonball Evolution,"action,adventure,fantasy","the young warrior son goku sets out on a quest, racing against time and the vengeful king piccolo, to collect a set of seven magical orbs that will grant their wielder unlimited power.",James Wong,"Justin Chatwin, James Marsters, Yun-Fat Chow, Emmy Rossum",2009.0,85.0,2.7,59512.0,9.35,45.0,,,,,,,,,,,,
873.0,Red Dawn,"action,thriller",a group of teenagers look to save their town from an invasion of north korean soldiers.,Dan Bradley,"Chris Hemsworth, Isabel Lucas, Josh Hutcherson, Josh Peck",2012.0,93.0,5.4,64584.0,44.8,31.0,,,,,,,,,,,,
874.0,One Day,"drama,romance","after spending the night together on the night of their college graduation dexter and em are shown each year on the same date to see where they are in their lives. they are sometimes together, sometimes not, on that day.",Lone Scherfig,"Anne Hathaway, Jim Sturgess, Patricia Clarkson,Tom Mison",2011.0,107.0,7.0,113599.0,13.77,48.0,,,,,,,,,,,,
875.0,Life as We Know It,"comedy,drama,romance",two single adults become caregivers to an orphaned girl when their mutual best friends die in an accident.,Greg Berlanti,"Katherine Heigl, Josh Duhamel, Josh Lucas, Alexis Clagett",2010.0,114.0,6.6,101301.0,53.36,39.0,,,,,,,,,,,,
876.0,28 Weeks Later,"drama,horror,sci-fi","six months after the rage virus was inflicted on the population of great britain, the us army helps to secure a small area of london for the survivors to repopulate and start again. but not everything goes to plan.",Juan Carlos Fresnadillo,"Jeremy Renner, Rose Byrne, Robert Carlyle, Harold Perrineau",2007.0,100.0,7.0,221858.0,28.64,78.0,,,,,,,,,,,,
877.0,Warm Bodies,"comedy,horror,romance","after a highly unusual zombie saves a still-living girl from an attack, the two form a relationship that sets in motion events that might transform the entire lifeless world.",Jonathan Levine,"Nicholas Hoult, Teresa Palmer, John Malkovich,Analeigh Tipton",2013.0,98.0,6.9,193579.0,66.36,59.0,,,,,,,,,,,,
878.0,Blue Jasmine,drama,"a new york socialite, deeply troubled and in denial, arrives in san francisco to impose upon her sister. she looks a million, but isn't bringing money, peace, or love...",Woody Allen,"Cate Blanchett, Alec Baldwin, Peter Sarsgaard, Sally Hawkins",2013.0,98.0,7.3,160592.0,33.4,78.0,,,,,,,,,,,,
879.0,G.I. Joe: Retaliation,"action,adventure,sci-fi",the g.i. joes are not only fighting their mortal enemy cobra; they are forced to contend with threats from within the government that jeopardize their very existence.,Jon M. Chu,"Dwayne Johnson, Channing Tatum, Adrianne Palicki,Byung-hun Lee",2013.0,110.0,5.8,152145.0,122.51,41.0,,,,,,,,,,,,
880.0,Wrath of the Titans,"action,adventure,fantasy","perseus braves the treacherous underworld to rescue his father, zeus, captured by his son, ares, and brother hades who unleash the ancient titans upon the world.",Jonathan Liebesman,"Sam Worthington, Liam Neeson, Rosamund Pike, Ralph Fiennes",2012.0,99.0,5.8,159230.0,83.64,37.0,,,,,,,,,,,,
881.0,Shin Gojira,"action,adventure,drama",japan is plunged into chaos upon the appearance of a giant monster.,Hideaki Anno,"Hiroki Hasegawa, Yutaka Takenouchi,Satomi Ishihara, Ren Ôsugi",2016.0,120.0,6.9,8365.0,1.91,68.0,,,,,,,,,,,,
882.0,Saving Mr. Banks,"biography,comedy,drama","author p.l. travers reflects on her childhood after reluctantly meeting with walt disney, who seeks to adapt her mary poppins books for the big screen.",John Lee Hancock,"Emma Thompson, Tom Hanks, Annie Rose Buckley, Colin Farrell",2013.0,125.0,7.5,125693.0,83.3,65.0,,,,,,,,,,,,
883.0,Transcendence,"drama,mystery,romance","a scientist's drive for artificial intelligence, takes on dangerous implications when his consciousness is uploaded into one such program.",Wally Pfister,"Johnny Depp, Rebecca Hall, Morgan Freeman, Cillian Murphy",2014.0,119.0,6.3,184564.0,23.01,42.0,,,,,,,,,,,,
884.0,Rio,"animation,adventure,comedy","when blu, a domesticated macaw from small-town minnesota, meets the fiercely independent jewel, he takes off on an adventure to rio de janeiro with the bird of his dreams.",Carlos Saldanha,"Jesse Eisenberg, Anne Hathaway, George Lopez,Karen Disher",2011.0,96.0,6.9,173919.0,143.62,63.0,,,,,,,,,,,,
885.0,Equals,"drama,romance,sci-fi","in an emotionless utopia, two people fall in love when they regain their feelings from a mysterious disease, causing tensions between them and their society.",Drake Doremus,"Nicholas Hoult, Kristen Stewart, Vernetta Lopez,Scott Lawrence",2015.0,101.0,6.1,16361.0,0.03,43.0,,,,,,,,,,,,
886.0,Babel,drama,"tragedy strikes a married couple on vacation in the moroccan desert, touching off an interlocking story involving four different families.",Alejandro González Iñárritu,"Brad Pitt, Cate Blanchett, Gael García Bernal, Mohamed Akhzam",2006.0,143.0,7.5,253417.0,34.3,69.0,,,,,,,,,,,,
887.0,The Tree of Life,"drama,fantasy","the story of a family in waco, texas in 1956. the eldest son witnesses the loss of innocence and struggles with his parents' conflicting teachings.",Terrence Malick,"Brad Pitt, Sean Penn, Jessica Chastain, Hunter McCracken",2011.0,139.0,6.8,143517.0,13.3,85.0,,,,,,,,,,,,
888.0,The Lucky One,"drama,romance",a marine travels to louisiana after serving three tours in iraq and searches for the unknown woman he believes was his good luck charm during the war.,Scott Hicks,"Zac Efron, Taylor Schilling, Blythe Danner, Riley Thomas Stewart",2012.0,101.0,6.5,82874.0,60.44,39.0,,,,,,,,,,,,
889.0,Piranha 3D,"comedy,horror,thriller","after a sudden underwater tremor sets free scores of the prehistoric man-eating fish, an unlikely group of strangers must band together to stop themselves from becoming fish food for the area's new razor-toothed residents.",Alexandre Aja,"Elisabeth Shue, Jerry O'Connell, Richard Dreyfuss,Ving Rhames",2010.0,88.0,5.5,75262.0,25.0,53.0,,,,,,,,,,,,
890.0,50/50,"comedy,drama,romance","inspired by a true story, a comedy centered on a 27-year-old guy who learns of his cancer diagnosis, and his subsequent struggle to beat the disease.",Jonathan Levine,"Joseph Gordon-Levitt, Seth Rogen, Anna Kendrick, Bryce Dallas Howard",2011.0,100.0,7.7,281625.0,34.96,72.0,,,,,,,,,,,,
893.0,Real Steel,"action,drama,family","in the near future, robot boxing is a top sport. a struggling promoter feels he's found a champion in a discarded robot.",Shawn Levy,"Hugh Jackman, Evangeline Lilly, Dakota Goyo,Anthony Mackie",2011.0,127.0,7.1,264480.0,85.46,56.0,,,,,,,,,,,,
894.0,Sex and the City,"comedy,drama,romance",a new york writer on sex and love is finally getting married to her mr. big. but her three best girlfriends must console her after one of them inadvertently leads mr. big to jilt her.,Michael Patrick King,"Sarah Jessica Parker, Kim Cattrall, Cynthia Nixon, Kristin Davis",2008.0,145.0,5.5,102547.0,152.64,53.0,,,,,,,,,,,,
895.0,Rambo,"action,thriller,war","in thailand, john rambo joins a group of missionaries to venture into war-torn burma, and rescue a group of christian aid workers who were kidnapped by the ruthless local infantry unit.",Sylvester Stallone,"Sylvester Stallone, Julie Benz, Matthew Marsden, Graham McTavish",2008.0,92.0,7.1,187077.0,42.72,46.0,,,,,,,,,,,,
898.0,The Fall,"adventure,comedy,drama","in a hospital on the outskirts of 1920s los angeles, an injured stuntman begins to tell a fellow patient, a little girl with a broken arm, a fantastic story of five mythical heroes. thanks to his fractured state of mind and her vivid imagination, the line between fiction and reality blurs as the tale advances.",Tarsem Singh,"Lee Pace, Catinca Untaru, Justine Waddell, Kim Uylenbroek",2006.0,117.0,7.9,93036.0,2.28,64.0,,,,,,,,,,,,
899.0,The Ugly Truth,"comedy,romance",a romantically challenged morning show producer is reluctantly embroiled in a series of outrageous tests by her chauvinistic correspondent to prove his theories on relationships and help ... see full summary »,Robert Luketic,"Katherine Heigl, Gerard Butler, Bree Turner, Eric Winter",2009.0,96.0,6.5,172558.0,88.92,28.0,,,,,,,,,,,,
900.0,Bride Wars,"comedy,romance",two best friends become rivals when they schedule their respective weddings on the same day.,Gary Winick,"Kate Hudson, Anne Hathaway, Candice Bergen, Bryan Greenberg",2009.0,89.0,5.5,83976.0,58.72,24.0,,,,,,,,,,,,
901.0,Sleeping with Other People,"comedy,drama,romance","a good-natured womanizer and a serial cheater form a platonic relationship that helps reform them in ways, while a mutual attraction sets in.",Leslye Headland,"Jason Sudeikis, Alison Brie, Jordan Carlos,Margarita Levieva",2015.0,101.0,6.5,27730.0,0.81,64.0,,,,,,,,,,,,
902.0,Snakes on a Plane,"action,adventure,crime","an fbi agent takes on a plane full of deadly and venomous snakes, deliberately released to kill a witness being flown from honolulu to los angeles to testify against a mob boss.",David R. Ellis,"Samuel L. Jackson, Julianna Margulies, Nathan Phillips, Rachel Blanchard",2006.0,105.0,5.6,118905.0,34.01,58.0,,,,,,,,,,,,
903.0,What If,"comedy,romance","wallace, who is burned out from a string of failed relationships, forms an instant bond with chantry, who lives with her longtime boyfriend. together, they puzzle out what it means if your best friend is also the love of your life.",Michael Dowse,"Daniel Radcliffe, Zoe Kazan, Megan Park, Adam Driver",2013.0,98.0,6.8,55243.0,3.45,59.0,,,,,,,,,,,,
904.0,How to Train Your Dragon 2,"animation,action,adventure","when hiccup and toothless discover an ice cave that is home to hundreds of new wild dragons and the mysterious dragon rider, the two friends find themselves at the center of a battle to protect the peace.",Dean DeBlois,"Jay Baruchel, Cate Blanchett, Gerard Butler, Craig Ferguson",2014.0,102.0,7.9,237565.0,177.0,76.0,,,,,,,,,,,,
